{
  "$schema": "https://json-schema.org/draft/2020-12/schema",
  "title": "redeem-request",
  "description": "POST /api/v1/licence/redeem body. (a) A key typed or pasted at a linked till. (b) Since 2026-09-28: a till holding a local key reports it once (keyType token, installCode, installId) - no branch key needed.",
  "type": "object",
  "properties": {
    "key": {
      "type": "string",
      "minLength": 6,
      "maxLength": 8192,
      "description": "Either a portal licence key (any format the portal chooses, e.g. SSPK-XXXX-XXXX-XXXX-XXXX) or a whole SSPOS1 token (a local key being reported: the token the till holds). The till trims spaces."
    },
    "keyType": {
      "type": "string",
      "enum": [
        "portalKey",
        "token"
      ],
      "description": "token when the text starts with SSPOS1., else portalKey. A courtesy - the portal may detect it itself."
    },
    "licenceId": {
      "anyOf": [
        {
          "$ref": "common.schema.json#/$defs/ulid"
        },
        {
          "type": "null"
        }
      ],
      "description": "The licence the till holds now."
    },
    "tokenSha256": {
      "anyOf": [
        {
          "$ref": "common.schema.json#/$defs/sha256Hex"
        },
        {
          "type": "null"
        }
      ]
    },
    "approverKids": {
      "type": "array",
      "items": {
        "$ref": "common.schema.json#/$defs/kid"
      },
      "description": "Built-in kids whose signer certificates this till accepts (docs/web-portal-api.md 17.17). Sign a returned token with a kid in trustedKids, or with your certified key when its certificate approvedBy is in this list."
    },
    "trustedKids": {
      "type": "array",
      "items": {
        "$ref": "common.schema.json#/$defs/kid"
      },
      "minItems": 1
    },
    "installCode": {
      "$ref": "common.schema.json#/$defs/installCode",
      "description": "This till's install code. For a local key report the portal records licenceId -> installCode on first sighting."
    },
    "installId": {
      "anyOf": [
        {
          "$ref": "common.schema.json#/$defs/installId"
        },
        {
          "type": "null"
        }
      ],
      "description": "This PC's install id (sent by tills from 2026-09-28; older tills omit it). Record it with the installCode."
    },
    "deviceName": {
      "type": [
        "string",
        "null"
      ],
      "maxLength": 60,
      "description": "The PC's name (sent by tills from 2026-09-28; older tills omit it)."
    },
    "appVersion": {
      "anyOf": [
        {
          "$ref": "common.schema.json#/$defs/appVersion"
        },
        {
          "type": "null"
        }
      ],
      "description": "The till's version (sent by tills from 2026-09-28)."
    },
    "os": {
      "anyOf": [
        {
          "$ref": "common.schema.json#/$defs/os"
        },
        {
          "type": "null"
        }
      ],
      "description": "Windows name, version and architecture (sent by tills from 2026-09-28)."
    },
    "tillClockUtc": {
      "anyOf": [
        {
          "$ref": "common.schema.json#/$defs/utc"
        },
        {
          "type": "null"
        }
      ],
      "description": "The till's clock when the request was first sent; a retry with the same Idempotency-Key repeats it (docs/web-portal-api.md 17.11 rule 5)."
    }
  },
  "required": [
    "key",
    "keyType",
    "licenceId",
    "tokenSha256",
    "trustedKids",
    "installCode"
  ]
}
