{
  "key": "SSPOS1.eyJ2IjoxLCJraWQiOiJrNzZiNDQ2OTYiLCJsaWNlbmNlSWQiOiIwMUs1TTFHUjhUMDAwMDAwMDAwMDAwWTAwMiIsImtpbmQiOiJmdWxsIiwic291cmNlIjoibG9jYWwiLCJpc3N1ZXIiOiJTU1BPUyBMaWNlbmNlIEdlbmVyYXRvciAtIE93bmVyIFBDIiwiY29tcGFueUlkIjoiIiwiYnJhbmNoSWQiOiIiLCJidXNpbmVzc05hbWUiOiJIeWRlIFBhcmsgTmV3cyBMdGQiLCJicmFuY2hOYW1lIjoiSHlkZSBQYXJrIiwiaW5zdGFsbENvZGUiOiIwTTAxLVRGRzYiLCJtYXhSZWdpc3RlcnMiOjIsImZlYXR1cmVzIjpbIndoYXRzYXBwIl0sImlzc3VlZEF0IjoiMjAyNi0wMy0zMVQxMDowMDowMFoiLCJ2YWxpZEZyb20iOiIyMDI2LTAzLTMxVDAwOjAwOjAwWiIsImV4cGlyZXNBdCI6IjIwMjctMDMtMzFUMjM6NTk6NTlaIiwibm90ZXMiOiJQYWlkIGJ5IGJhbmsgdHJhbnNmZXIsIGludm9pY2UgMTA0MiJ9.c2IlqHOT1WguKa1H6aTEvKWKBiIoejoTubfayzeZhqx-g6apnMwPfM-R1vIbE_DAspKZrY289Bqm7fPWCtOtCg",
  "keyType": "token",
  "licenceId": "01K5M1GR8T000000000000Y002",
  "tokenSha256": "b21ec86ab81fd0ba35b96706f913d8a5a3bcd0de4668a4a91a0af265428a7cac",
  "approverKids": [
    "k76b44696"
  ],
  "trustedKids": [
    "k13799fa4",
    "k76b44696"
  ],
  "installCode": "0M01-TFG6",
  "installId": "01K5M1GR8T000000000000H009",
  "deviceName": "HYDEPARK-TILL",
  "appVersion": "3.0.412",
  "os": {
    "name": "Windows",
    "version": "10.0.26200",
    "architecture": "x64"
  },
  "tillClockUtc": "2026-09-26T10:14:58Z"
}
